"year","number","question","answer","choice1","choice2","choice3","choice4","choice5"
"2025","1","森林・林業基本計画（令和3（2021）年）における、森林の有する多面的機能を発揮するうえでの望ましい森林の姿の例示に関する次の記述のうち、最も不適切なものはどれか。","4","①山地災害防止機能／土壌保全機能に応じた望ましい森林は、下層植生が生育するための空間が確保され、適度な光が射し込み、下層植生とともに木の根が深く広く発達し土壌を保持する能力に優れた森林であって、必要に応じて山地災害を防ぐ施設が備されている森林である。","②生物多様性保全機能は、すべての森林が発揮する機能であるが、属地的に機能が発揮されるものを示せば、原生的な森林生態系、希少な生物が生育・生息する森林，陸域・水域にまたがり特有の生物が生育・生息する渓畔（けいはん）林等、その土地固有の生物群集を構成する森林である。","③地球環境保全機能は、二酸化炭素の吸収や炭素の固定、蒸発散作用等により地球環境を調節する属地性のない機能であり、すべての森林が発揮するものである。","④快適環境形成機能に応じた望ましい森林は、身近な自然・自然とのふれあいの場として適切に管理され、多様な種等からなり、住民等に憩いと学びの場を提供している森林であって、必要に応じて保健・教育活動に適した施設が整備されている森林である。","⑤木材等生産機能に応じた望ましい森林は、林木の生育に適した土壌を有し、木材として利用するうえで良好な木により構成され成長量が大きい森林であって、林道等の基盤施設が適切に整備されている森林である。"
"2025","2","森林計画制度に関するの記述のうち、最も不適切なものはどれか。","1","①森林・林業基本計画は、政府が、森林及び林業に関する施策の総合的かつ計画的な推進を図るために定める計画で、概ね10年ごとに変更するものとされている。","②全国森林計画は、農林水産大臣が、森林・林業基本計画に即し、かつ、保安施設の整備の状況等を勘案して、全国の森林につき、5年ごとに、15年を1期としてたてる計画である。","③地域森林計画は、都道府県知事が、全国林計画に即して、、森林計画区別に、その森林計画区に係る民有林につき、5年ごとに、10年を1期としてたてる計画である。","④市町村森林整備計画は、市町村が、その区域内にある地域森林計画の対象となっている民有林につき、5年ごとに、10年を1期としてたてる計画である。","⑤森林経営計画は、森林所有者又は森林所有者から森林の経営の委託を受けた者が、自らが森林の経営を行う森林であってこれを一体として備する森林を対象に、単独で又は共同して、5年を1期として作成する計画である。"
"2025","3","林木の育種・育苗に関する次の記述のうち、最も不適切なものはどれか。","5","①林木の種子の寿命は種によって大きく異なり、数週間で発芽力を失うものもあれば、数十年にわたって発芽力を維持するものもある。","②林木の育種には長い年月を要するので、これを短縮させるための手段として、組織培養、DNA分析などのバイオテクノロジーの利用が考えられる。","③苗木の「T／R率」とは、苗木を掘り上げて根の土を落としたうえで、根際から切断し、地上部と地下部の生重量を測定し、「地上部重量（g）÷ 地下部重量（g）」を求めたものである。","④コンテナ苗の栽培に用いられるコンテナは、底面が開放されており、また、キャピティ（育成孔）の側壁にリブ（縦筋の突起）やスリット（縦長の隙間）があり、根巻きを防ぐ構造となっている。","⑤苗畑において苗木の下方に長く伸びた直根を切りつめる作業を根切りといい。苗木への水分の供給を抑制することで、徒長と細根の発生を促し、移植に強い苗木を作る効果などがある。"
"2025","4","森林計測に関するの記述のうち、最も不適切なものはどれか。","2","①胸高直径を測定する際、精密に測定する場合はmm単位で測定することもあるが、通常は2cm括約で測定することが一般的である。","②胸高直径を測定する際、こぶや技などで胸高位置が太くなっている場合は、太いところを避け、胸高位置の上側で測定した値を使用する。","③高は、測定位置から立木までの距離と測定位置から相及び根までのそれぞれの角度を測ることにより、三角比の原理で求めることができる。","④森林内での柑高の測定は胸高直径の測定に比べると労力と時間がかかることなどから、林分内で標本調査を行い，樹高曲線を作成して、胸高直径から高を推定する方法がある。","⑤丸太材積の求積式の1つにフーベル式（Huber式）があり、これは丸太の中央断面積に材長をかけることで材積を求めるものである。"
"2025","5","列状間伐の特徴（優れた点・留意する点）に関する次の記述のうち、最も不適切なものはどれか。","4","①優勢木と劣勢木の割合は、間伐前後で変わらないため、間伐後に形質不良も残る。","②選木は機械的に行うため、容易である。","③残存列が広い場合，伐採列に面しない残存木に間伐効果が及びにくい。","④定性間に比べて、かかり木になりやすいため、適切な伐倒方法により倒方向を確実にする必要がある。","⑤定性間に比べて、残存木の損傷を軽減できる。"
"2025","6","保育作業の実施時期に関する次の記述のうち、最も不適切なものはどれか。","3","①除代は、下刈り後から林分閉鎖までの間、広葉樹を除する場合，ぼう芽力の弱い初夏に行うと効率が良い。","②間伐は、おおよそ10～20年生で開始し、通常は幼壮齢期は5～10年間隔、高齢期は10～20年間隔で繰り返す。作業は成長休止期に実施し、風害・雪害の発生時期は避けることが望ましい。","③枝打ちは、生産目的によるが、幹径がおおよそ10.5cmまでに行えば四面無節の柱材がとれる。厳冬期に行うと効率が良い。","④つる切りは、下刈り後から林分閉鎖までの間、及び除間伐直後、つるが根の貯蔵養分を使い果たした7月頃に行う。","⑤下刈りは、植栽木が雑草木より大きくなるまでの間を目安に、通常は初夏から盛夏に1回又は2回行う。"
"2025","7","森林の経営・管理に関する次の記述うち、最も不適切なものはどれか。","2","①森林を経営し、施業を行うに当たり遵守すべき原則には、公共性の原則，合自然性の原則，保続性の原則，経済性の原則。生物多様性保全の原則などがある。","②林木の価値の評価法には、費用価法、期待価法，市場価逆算法，スマリアン法，グラーゼル法などがある。","③林木の伐期齢には、工芸的伐期齢，森林純収益最高の伐期齢，土地純収益最高の伐期齢，労働生産性最大の伐齢などがある。","④収穫規整には、区画輪法，面積平分法，折衷平分法、齢級法，法正蓄積法などがある。","⑤法正林を成立させる条件には、法正齢配置、法正林分配置、法正成長量などがある。"
"2025","8","環境影響評価と自然生に関する次の記述のうち，最も不適切なものはどれか。","2","①自然環境保全に関するアセスメントを自然環境アセスメントといい，開発行為が生物多様性や自然とのふれあい活動の場に与える影響が評価され、必要に応じて環境保全措置（ミティゲーション）が実施される。","②スクリーニング手続は、重大な環境影響の回避・低減を図るために、事業計画の早期段階で、位置・規模又は配置・構造に関する複数案から環境影響の比較検討を行うものである。","③スコーピングとは、事業と地域の特性に応じて、環境影響評価の方法を検討し、項目や手法の重点化と簡略化を図ってメリハリの利いたものにするための手続のことである。","④環境保全措置（ミティゲーション）で取られる具体的な措置は回避、低減，代償に大別されるが、この3つには優先順位があり、まず回避によって生態系の保全を図り、回避しきれずに生じた影響を低減し、低減してもなお残った影響を代償するという順序が原則である。","⑤自然再生とは、過去に失われた自然を取り戻すことであり、「湿原内の直線化された河川を再蛇行化させることなどによる湿原の再生」、「産廃処理施設の集積により失われた雑木林の再生」，「埋立地を渡り鳥の飛来する干潟に再生」などの例がある。"
"2025","9","ミレニアム生態系評価及び生態系サービスに関するの記述のうち、最も不適切なものはどれか。","5","①ミレニアム生態系評価では、生態系サービスを基盤サービス、調節サービス、供給サービス，文化的サービスの4つの機能に分類している。","②基盤サービスは、他のすべてのサービスを支えるもので、生態系の物質循環や生物多様性，一次生産、土壌の形成などである。","③調節サービスは、大気環境・気候の調節，水資源の調節，土壌侵食の調節，自然災害からの防護など、さらに、病虫害の抑制，花粉媒介や種子散布なども含まれる。","④文化的サービスは、レクリエーションや環境教育の場、審美的な楽しみ、宗教や霊的な基盤，生態系から得られる非物質的・精神的な価値のことである。","⑤ミレニアム生態系評価では、過去50年間に大きな生態系サービスの変化があり、世界の人口増加により、供給サービスにおける穀物、家畜及び養殖漁業は低下し、調節サービスと文化的サービスの多くが向上したと報告されている。"
"2025","10","日本の森林帯に関する次の記述のうち、最も不適切なものはどれか。","4","①亜寒帯常緑針葉林：モミ属、トウヒ属などにより構成され、北海道や本州の高標高地に分布している。","②冷温帯落葉広葉林：ブナ，ミズナラなどにより構成され、北海道の低地，東北地方，関東・北陸から九州の山地に分布している。","③暖温帯落葉広葉林：クリ、ナラ類，シデ類などにより構成され、本州の中部から東北地方の内陸部に分布している。","④暖温帯照葉林：シイ類，カシ類などにより構成され、九州（屋久島含む）から北海道南部まで分布している。","⑤亜熱帯多雨林：アコウ，ガジュマル、マングローブなどにより構成され、沖縄や奄美の島々、小笠原諸島に分布している（小笠原諸島では固有の植物）。"
"2025","11","森林の生物多様性を高めるための森林管理手法に関するの記述のうち，最も不適切なものはどれか。","3","①森林において、多様な動植物の生育・生息環境を確保するには、一定の面的広がりにおいて、様々な種，林分構造，林齢，遷移階などから構成される森林をバランスよく配置することが重要である。","②人工林で共通して取り組むべき事項としては、適時・適切な間の実施などの計画的な森林施業に加え、土砂流出や土壌侵食の防止，生物多様性保全上重要な渓畔の保全などである。","③育成単層林の主後は、多様な樹種を育成するため、前生稚や周辺の母材を利用した天然更新の選択を原則とする。","④長期間にわたって放置された広葉二次林は、大径化し、ナラれ被害の拡大の要因にもなっている。それらの整備は、小面積皆伐などの伐採とぼう芽更新の繰り返しなどにより資源の利用を回復させることが重要となる。","⑤森林におけるシカの食害対策は重要な課題であり、シカ対策は、個体群管理、被害防除対策、生息環境管理の3つの施策を柱として実施する。特に防護柵等の設置は、植栽木等による確実な更新を図り、絶滅危惧種等の保全、伐採地の餌資源の利用を制限する施策として重要である。"
"2025","12","森林の気象被害における森林火災に関する次の記述のうち、最も不適切なものはどれか。","5","①地表火は、地形と風の影響を受けやすく、特に地表（林床）可燃物が多いときには林木の損傷が大きくなり、幹火や冠火へと移行しやすい。","②幹火は、老齢の針葉などの粗いものや、脂の染み出ているもの，立枯れ木、空洞のある大木などで起こりやすい。","③冠火は、アカマツやスギ、ヒノキなどの針葉に起こりやすく、多くの場合林木は地上部分が枯死する。","④地中火は、空気の供給が少ない地中で延焼が進むため、火勢は弱く延焼速度も遅いが、簡単には鎮火せず、延焼方向も複雑で、完全な消火は難しい。","⑤我が国における森林火災は、紅葉が見頃となる秋の行楽シーズンに集中して発生しており、ほとんどは人間の不注意に起因している。"
"2025","13","森林の景観保全・風致施業に関するの記述のうち、最も不適切なものはどれか。","4","①風致施業は主に自然公園内の森林，レクリエーションの森のように景観資源として利用される森林のほか、日常生活域の身近な森林も含め、景観上で重要な森林はすべて風致施業の対象になる。","②自然林内では、危険木や歩道の通行に支障となる倒木を除去するなど、必要最小限の管理だけを行う方法が主流である。","③スギ・ヒノキなどの人工林は、枝打ち・間伐を励行することよって、林内の見通しがよくなるとともに林床の照度が増し、林床植物が繁茂して低木や草本を鑑賞できるようになる。","④代表的な名勝地である京都の嵐山の魅力は、春のサクラ、秋の紅葉などの森林景観であり、現状を改変する行為を禁止することによって景観が保全されている。","⑤京都の北山杉などのように強度の枝打ちを施した林分では、整然と立ち並ぶ幹が美しい景観を形作る。近年、住宅様式の変化に伴う床柱銘木などの需要減がこのような林業景観にも影響を与えつつある。"
"2025","14","日本の森林土壌に関するの記述のうち、最も不適切なものはどれか。","3","①日本は一般に温暖・多雨であるため、森林土壌の塩基類（K、Ca,Mgなど）は流亡しやすく、酸性を呈する。","②森林土壌の生成に影響する斜面形状は、上昇科面、平衡斜面，下降斜面に大別される。上昇斜面は斜面上部に残積土が厚く、下降科面は斜面下部に水分や土砂が集まりやすく崩積土が多い。","③褐色森林土壌群は、温暖・多雨の気候下で生成され、日本に最も多く分布する。溶脱。集積が認められ、典型、暗色型、赤色型，黄色型，表層グライ型の5つの亜群がある。","④土壌の固体・水・空気の容積比を固相・液相・気相の三相組成と呼ぶ。三相組成は自然状態の土壌コアを各層位から採土円筒で採取して測定する。","⑤土壌の水分保持力は、孔隙の状態によって異なる。土壌水分は、水分保持力の程度で重力水、毛管水，吸着水などと呼ばれ、このうち植物に利用可能な水分は重力水，毛管水である。"
"2025","15","治山事業に関する次の記述のうち、最も不適切なものはどれか。","1","①保安施設事業は、森林法第25条第1項第1号（水源かん養）から第11号（名所又は旧跡の風致の保存）までに掲げる保安林の指定の目的を達成するため、森林の造成事業又は森林の造成若しくは維持に必要な事業をいう。","②民有林直轄治山事業は、国土の保全上特に重要であると認められ、事業の規模が著しく大であるとき、事業が高度の技術を必要とするとき等において、都道府県の要請も踏まえ、国が国有林野以外の森林又は原野その他の土地において実施する。","③治山事業とは、森林法に規定する保安施設事業及び地すべり等防止法に規定する地すべり防止工事又はぼた山崩壊防止工事に関する事業をいう。","④地すべり等防止法での地すべりとは、土地の一部が地下水等に起因してすべる現象又はこれに伴って移動する現象をいう。","⑤砂防は、山地上流域から下流へ流出する土砂流木，水などによる災害を防止若しくは軽減するものであり、治山は、森林の荒廃による災害を防止・軽減し、森林の復や保全と適切な防災施設の配置により、その森林が有する特定の公益的機能を保全・補完するものである。"
"2025","16","森林の水文現象に関する次の記述のうち、最も不適切なものはどれか。","4","①森林の地表面流は、降雨余剰から発生するホートン型地表流と、地下水面が地上まで到達し、地表面流となる復帰流（飽和地表流）に分けられる。","②冠に到達した降水のうち冠に付着した水分は、林床へ滴下する冠滴下雨成分、蒸発して大気に戻る冠遮断成分、幹を伝わって林床へ到達する幹流成分に分けられる。","③林地斜面の透水性は、深さとともに低下する傾向があり、透水性が浸透強度に比べて小さくなる深度まで雨水が到達すると一時的な地下水帯が形成され、斜面下方に向かって土層内に移動し河道に流出する。この土層内の流れを飽和側方流と呼ぶ。","④雨水は種々のプロセスを経て斜面から流出し、山地河川の流出波形を形成するが、流出強度の時系列を示した図はハイエトグラフと呼ばれ、これに対して降雨強度の時系列を示した図はハイドログラフと呼ばれている。","⑤流出解析には、合理式，単位図法、貯留関数法やタンクモデルなど種々の手法が提示されている。そのうち、合理式は治山堰堤の放水路などの設計の際に、計画水流量を見積もる手法として用いられる。"
"2025","17","土石流に関する次の記述のうち、最も不適切なものはどれか。","4","①土石流は、その流動特性から、粘土やシルトなどのような微細粒子と水からなる高濃度泥流と、砂や石礫のような比較的粗大な粒子と水からなる混合物の2種類に基本的には分類されている。","②土石流とは、水と土砂や石礫からなる混合物が一種の流体となって移動する現象で，日本で古くは山津波，鉄砲水と呼ばれていた。","③土石流の堆積形状は、一般に平面的には先端部が舌状にやや開いた錘型を、縦断的にはほぼ2資曲線に近い形を呈し、横断的には中央部が盛り上がったかまぼこ型を呈している。","④土石流対策用の遮水型ダムは、土石流へッドを構成する巨礫を対象にし、構造物を用いてそれを分離することにより土石流状態から掃流状態に変化させ、また質量を減少させて、土石流の減勢とエネルギー減殺を図るものである。","⑤土石流発生流の河床の堆積構造は、大小さまざまの石礫や土砂が複雑に混じりあった非層状構造を呈するのが特徴である。"
"2025","18","治山ダムに関するの記述のうち、最も不適切なものはどれか。","3","①治山ダムは、構造上の安定方式からは、重力式、アーチ式、バットレス式等に分けられる。","②重力式治山ダムは、その安定を保つために、堤体が転倒を引き起こさないこと、堤体が滑動を引き起こさないこと、堤体の最大応力に対して破壊を引き起こさないこと、堤体の最大応力に対して基礎地盤の地耐力が十分であること、の4条件を満たすものでなければならない。","③コンクリートブロック治山ダムは、基礎地盤が岩盤の場合又は短期間に工事を完成させる必要がない場合に用いられる。","④治山ダムの水抜きは、施工中の排水及び推砂後の浸透水圧の軽減が可能となるように設置する。また、堤体の弱点とならないようにその位置、大きさに配慮しなければならない。","⑤治山ダムの放水路断面は、洪水時に流水とともに流下する砂礫，流木、土石流等を考慮して、余裕を見込んで決定しなければならない。"
"2025","19","渓流工事に関するの記述のうち、最も不適切なものはどれか。","3","①流路工は、流路を固定して乱流を防止するとともに縦断配を規制して、縦横侵食の防止を図ることを目的とする。","②護岸工は、流水による渓岸の横侵食の防止及び山腹崩壊の防止又は山腹工の基礎とすることを目的とする。","③護岸工は、一般には自立式護岸工が多いが、必要に応じもたれ式護岸工を用いる。また、護岸工ののり勾配は、河床勾配が急なほど勾配とするのが一般的である。","④水制工は、流心を渓岸から遠ざけ、流路を規制し、渓岸の侵食防止又は護岸の洗掘防止を図ることを目的とする。","⑤床固工は、縦侵食を防止して渓床の安定と堆積物の再移動の防止，護岸などの工作物の基礎保護及び整流機能をもつ。"
"2025","20","山腹工に関する次の記述のうち、最も不適切なものはどれか。","5","①山腹工は、その機能により、山腹斜面の安定を図る土木的工法の山腹基礎工，山腹斜面の植生を回復するための山腹緑化工及び落石の防止・軽減を図る落石防止工に分類される。","②のり切工は、崩壊地外縁及び内部の崩壊のおそれのある部分に対して、より安定した勾配に切り均し整形し、崩壊及び崩壊の拡大を防止することを目的とする。","③落石予防工は、落石の発生源における対策であり、落下するおそれのある浮石・転石又は亀裂の多い露岩を除去又は固定して、落石の発生を防止することを目的とする。","④実播工に使用する種子の選択及び組合せは、それぞれの植物の特徴を十分把握し、周辺環境を考慮のうえ、最も適切な組合せとなるように決定するが、一般に、早期の緑化による表面侵食防止効果を期待することから、草本類を主体とした方式が用いられる。","⑤筋工は，山腹基礎工に分類され、崩壊地内にある不安定士砂を固定して崩壊を防止するとともに，植生の早期導入のため生育環境の改善を図ることを目的とする。"
